id1,id2,joinKey1,joinKey2,OG-Company-Warn,OG-Company-Nasdaq,jaccard
24660,MTB,"[m,t,bank,corporation]","[m,t,bank,corporation,common,stock]",M&T Bank Corporation,M&T Bank Corporation Common Stock,0.6666666666666666
5484,RWT,"[redwood,trust,inc]","[redwood,trust,inc,common,stock]",Redwood Trust Inc,Redwood Trust Inc. Common Stock,0.6
14230,ABG,"[asbury,automotive,group,inc]","[asbury,automotive,group,inc,common,stock]","Asbury Automotive Group, Inc.",Asbury Automotive Group Inc Common Stock,0.6666666666666666
15974,ARW,"[arrow,electronics,inc]","[arrow,electronics,inc,common,stock]","Arrow Electronics, Inc.",Arrow Electronics Inc. Common Stock,0.6
20577,BA,"[the,boeing,company]","[boeing,company,the,common,stock]",The Boeing Company,Boeing Company (The) Common Stock,0.6
19174,ADVWW,"[advantage,health,solutions,inc]","[advantage,solutions,inc,warrant]","ADVANTAGE Health Solutions, Inc",Advantage Solutions Inc. Warrant,0.6
20589,BA,"[the,boeing,company]","[boeing,company,the,common,stock]",The Boeing Company,Boeing Company (The) Common Stock,0.6
3180,T,"[at,t]","[at,t,inc]",AT&T,AT&T Inc.,0.6666666666666666
41212,AMN,"[healthcare,services,group,inc]","[amn,healthcare,services,inc,amn,healthcare,services,inc]","Healthcare Services Group, Inc.",AMN Healthcare Services Inc AMN Healthcare Services Inc,0.6
8458,UBER,"[uber,technologies,inc]","[uber,technologies,inc,common,stock]","Uber Technologies, Inc.",Uber Technologies Inc. Common Stock,0.6
